{"history_length":2,"is_replaying":false,"jobs":[{"kind":"resolve_child_workflow_start","result":{"failure":{"cause":{"cause":null,"encoded_attributes":null,"info":{"details":[],"identity":"","kind":"canceled"},"message":"","source":"","stack_trace":""},"encoded_attributes":null,"info":{"initiated_event_id":1,"kind":"child_workflow","namespace":"default","retry_state":"non_retryable_failure","run_id":"","started_event_id":0,"workflow_id":"child-id-1","workflow_type":"child"},"message":"Child Workflow Execution cancelled before scheduled: acceptance child cancelled","source":"","stack_trace":""},"kind":"cancelled"},"seq":1}],"run_id":"parent-run","timestamp":{"nanoseconds":0,"seconds":0}}
