{"history_length":3,"is_replaying":false,"jobs":[{"arguments":[{"data":{"data":"","encoding":"base64"},"metadata":{}}],"attempt":1,"context":{"continuation":null,"first_execution_run_id":"first-run","headers":{"a-trace":{"data":{"data":"","encoding":"base64"},"metadata":{}},"z-trace":{"data":{"data":"","encoding":"base64"},"metadata":{"a-key":{"data":"YQ==","encoding":"base64"},"z-key":{"data":"eg==","encoding":"base64"}}}},"identity":"starter","parent_workflow":null,"priority":{"fairness_key":"tenant-a","fairness_weight_bits":1069547520,"priority_key":2},"retry_policy":null,"root_workflow":null,"start_time":{"nanoseconds":123,"seconds":1720000000},"workflow_execution_timeout":{"nanoseconds":0,"seconds":3600},"workflow_run_timeout":{"nanoseconds":0,"seconds":600},"workflow_task_timeout":{"nanoseconds":0,"seconds":10}},"kind":"initialize_workflow","randomness_seed":"18446744073709551615","workflow_id":"order-42","workflow_type":"order_workflow"}],"metadata":{"available_internal_flags":[1,2],"continue_as_new_suggested":true,"deployment_version_for_current_task":{"build_id":"build-1","deployment_name":"prod"},"history_size_bytes":"9999","last_sdk_version":"1.2.3","suggest_continue_as_new_reasons":["history_size_too_large"],"target_worker_deployment_version_changed":true},"run_id":"run-1","timestamp":{"nanoseconds":456,"seconds":1720000001}}
