{"history_length":12,"is_replaying":false,"jobs":[{"arguments":[{"data":{"data":"ImhpIg==","encoding":"base64"},"metadata":{"encoding":{"data":"anNvbi9wbGFpbg==","encoding":"base64"}}}],"attempt":1,"kind":"initialize_workflow","randomness_seed":"18446744073709551615","workflow_id":"order-42","workflow_type":"process_order"},{"kind":"resolve_activity","result":{"kind":"completed","payload":{"data":{"data":"b2s=","encoding":"base64"},"metadata":{}}},"seq":1},{"kind":"resolve_activity","result":{"failure":{"cause":null,"encoded_attributes":null,"info":{"details":[],"kind":"application","non_retryable":true,"type":"BadInput"},"message":"invalid input","source":"test-sdk","stack_trace":""},"kind":"failed"},"seq":2},{"kind":"resolve_activity","result":{"failure":{"cause":{"cause":null,"encoded_attributes":null,"info":{"details":[],"identity":"client","kind":"canceled"},"message":"cancel requested","source":"server","stack_trace":""},"encoded_attributes":null,"info":{"activity_id":"lookup-3","activity_type":"lookup","identity":"worker","kind":"activity","retry_state":"cancel_requested","scheduled_event_id":10,"started_event_id":11},"message":"activity cancelled","source":"server","stack_trace":""},"kind":"cancelled"},"seq":3},{"kind":"fire_timer","seq":4},{"kind":"cancel_workflow","reason":"operator request"}],"run_id":"01234567-89ab-cdef-0123-456789abcdef","timestamp":{"nanoseconds":123456789,"seconds":1720000000}}
