{"history_length":9,"is_replaying":true,"jobs":[{"arguments":[],"attempt":1,"kind":"initialize_workflow","randomness_seed":"42","workflow_id":"parent-42","workflow_type":"parent_workflow"},{"kind":"resolve_child_workflow_start","result":{"kind":"succeeded","run_id":"child-run-42"},"seq":7},{"kind":"resolve_child_workflow","result":{"kind":"completed","payload":{"data":{"data":"Y2hpbGQtcmVzdWx0","encoding":"base64"},"metadata":{}}},"seq":7}],"run_id":"parent-run","timestamp":{"nanoseconds":0,"seconds":1720000000}}
